article_id,content,narrative,subnarrative,narrative_subnarrative,domain
"PT_29.txt","Envio de soldados da NATO para a Ucrânia é 'alerta de apocalipse', diz primeiro-ministro eslovaco

O primeiro-ministro da Eslováquia, Robert Fico, afirmou este sábado (2) que o envio de militares da União Europeia (UE) e da Organização do Tratado do Atlântico Norte (NATO) para a Ucrânia pode precipitar o apocalipse global.

Num vídeo divulgado nas redes sociais, destacou a incapacidade ucraniana em resolver o conflito, apesar da substancial ajuda financeira e militar prestada pelo Ocidente.

Salientou que, embora a presença militar da UE e da NATO possa potencialmente alterar a dinâmica do conflito, também poderá desencadear consequências catastróficas. 'O Ocidente vê que, apesar da ajuda financeira e militar significativa, a Ucrânia é incapaz de resolver este conflito armado'.

'A situação poderia mudar com a chegada de militares da UE e da NATO à Ucrânia, mas então não restaria nada senão esperar a chegada do apocalipse global', afirmou o primeiro-ministro eslovaco.

Fico salientou a necessidade premente de sistemas de defesa aérea modernos para a Ucrânia, mas alertou que o Ocidente não pode fornecer estes sistemas sem o compromisso de manter e operar estes equipamentos.

Argumentou ainda que o envio de militares ocidentais apenas agravaria o conflito, em vez de o resolver.

A Rússia prossegue com a operação militar especial na Ucrânia desde fevereiro de 2022. O presidente russo, Vladimir Putin, justificou a ação como uma medida para proteger a população contra o 'genocídio' por parte do regime de Kiev e para conter o avanço da NATO em direção a leste.

Moscovo tem alertado repetidamente contra o fornecimento de armas a Kiev pelo Ocidente, afirmando que os comboios estrangeiros que transportam armas seriam alvos legítimos para as suas forças assim que atravessassem a fronteira.

Além disso, o ministro dos Negócios Estrangeiros russo, Sergei Lavrov, acusou os Estados Unidos e a NATO de já estarem diretamente envolvidos no conflito na Ucrânia, não só através do fornecimento de armas, mas também através da formação de pessoal em vários países europeus.
","Amplifying war-related fears;Discrediting Ukraine;Speculating war outcomes;Discrediting Ukraine;Russia is the Victim;Negative Consequences for the West;Discrediting the West, Diplomacy","Other;Situation in Ukraine is hopeless;Other;Ukraine is a hub for criminal activities;Russia actions in Ukraine are only self-defence;Other;Other","Amplifying war-related fears: Other;Discrediting Ukraine: Situation in Ukraine is hopeless;Speculating war outcomes: Other;Discrediting Ukraine: Ukraine is a hub for criminal activities;Russia is the Victim: Russia actions in Ukraine are only self-defence;Negative Consequences for the West: Other;Discrediting the West, Diplomacy: Other","URW"
"PT_54.txt","Dugin: 'A Ucrânia é o Primeiro Conflito Multipolar'

Numa entrevista para a cadeia de televisão internacional, RT, Alexander Dugin explicou rapidamente a dimensão geopolítica do conflito ucraniano e as bases do mundo multipolar que se levanta contra o universalismo imperialista do Ocidente.

O conflito na Ucrânia é a 'primeira guerra multipolar' do mundo, na qual a Rússia luta pelo direito de cada civilização escolher o seu próprio caminho enquanto o Ocidente deseja manter o seu globalismo totalitário hegemónico, disse Aleksandr Dugin à RT numa entrevista exclusiva, na sexta-feira.

A multipolaridade não é 'contra o Ocidente enquanto tal', disse Dugin, mas 'contra a reivindicação do Ocidente de ser o modelo, de ser o exemplo único' da história e da compreensão humana. A atual russofobia e o ódio à Rússia, argumentou, são uma relíquia do pensamento da Guerra Fria e do 'entendimento bipolar da arquitetura das relações internacionais'.

Quando a União Soviética se autodestruiu, em dezembro de 1991, deixou a 'civilização liberal global ocidental' no controlo do mundo, observou Dugin. Este hegemon recusa-se agora a aceitar o futuro no qual seria 'não um dos dois, mas um dos [poucos] polos', colocado no seu devido lugar como 'apenas uma parte, não o todo, da humanidade'.

Dugin descreveu o Ocidente como 'puro liberalismo totalitário', que finge ter a verdade absoluta e procura impô-la a todos. 'Há racismo inerente ao liberalismo ocidental', disse o filósofo a Donald Courter, da RT, porque 'identifica a experiência histórica, política, cultural, ocidental [como] universal'.

'Não existe nenhum universal na multipolaridade', insistiu Dugin, explicando que cada civilização pode e deve desenvolver os seus próprios valores. A Rússia precisa especificamente de ultrapassar séculos de domínio ideológico ocidental, disse, e criar algo 'novo, fresco, criativo' que, no entanto, permaneceria 'em refutação direta da hegemonia liberal ocidental, contra a sociedade aberta, contra o individualismo, contra a democracia liberal'.

Rejeitou as atitudes 'dogmáticas' do marxismo, do fascismo ou do liberalismo em relação à política e à economia, dizendo que a Rússia deveria lutar por uma abordagem 'holística', em que o espiritual seria mais importante do que o material. A obsessão pelos bens materiais acaba por escravizar as pessoas, disse Dugin à RT.

Dugin lamentou o colapso da União Soviética, em dezembro de 1991, como um 'suicídio' perpetrado pelos burocratas ávidos de poder em Moscovo. Fez eco da descrição do presidente russo, Vladimir Putin, do evento, como um 'desastre geopolítico' e descreveu-o como uma grande vitória do 'Poder do Mar'. Enquanto a URSS era o oposto polar do Império Russo em termos ideológicos, explicou, em termos geopolíticos os dois eram um e o mesmo, o poder mais forte naquilo que o geógrafo inglês Harold Mackinder descreveu como o Heartland global.

Enquanto alguns observadores ocidentais chamaram a Dugin o 'cérebro de Putin', o filósofo e autor de 60 anos não tem qualquer relação oficial com o Kremlin. É um defensor declarado da atual operação militar na Ucrânia — cuja independência considera um projeto imperial ocidental contra a soberania russa.

A filha de Dugin, Daria, de apenas 29 anos, foi assassinada em agosto por um carro armadilhado colocado por agentes ucranianos. Embora Kiev o tenha negado oficialmente, os responsáveis dos serviços de informação dos EUA disseram mais tarde acreditar no envolvimento e na responsabilidade de alguém no governo ucraniano.
","Blaming the war on others rather than the invader;Russia is the Victim;Discrediting the West, Diplomacy;Praise of Russia;Discrediting Ukraine","The West are the aggressors;The West is russophobic;Other;Other;Other","Blaming the war on others rather than the invader: The West are the aggressors;Russia is the Victim: The West is russophobic;Discrediting the West, Diplomacy: Other;Praise of Russia: Other;Discrediting Ukraine: Other","URW"
"PT_47.txt","Zelensky admite a inevitabilidade da retirada das tropas de Kiev do campo de batalha

Em entrevista ao jornal Washington Post, presidente ucraniano reconheceu a escassez de armamento enfrentada pelas forças ucranianas e disse que, sem ajuda dos EUA, as tropas terão de bater em retirada.

As Forças Armadas da Ucrânia recuarão constantemente se os Estados Unidos não prestarem a assistência necessária. Foi o que declarou esta sexta-feira (29) o presidente ucraniano, Vladimir Zelensky, em entrevista ao jornal Washington Post.

'Se não houver apoio dos Estados Unidos, isso significa que não teremos defesa aérea, nem mísseis Patriot, nem equipamento de interferência eletrónica, nem projéteis de artilharia de 155 milímetros. Isto significa que recuaremos, passo a passo, pequenos passos [no campo de batalha]', disse Zelensky.

Acrescentou que a Ucrânia enfrenta problemas na defesa aérea, e disse que sem apoio do Congresso dos EUA haverá escassez de mísseis.

'Sem o apoio do Congresso [dos EUA], teremos uma grande escassez de mísseis. Isso é um problema. Estamos a construir os nossos próprios sistemas de defesa aérea, mas isso não é suficiente'.

Segundo disse, as Forças Armadas ucranianas estão a tentar encontrar uma forma de não recuar na zona de combate.

'Se a situação na frente de combate se mantiver estável, então na retaguarda a Ucrânia será capaz de armar e treinar novas brigadas para lançar uma nova tentativa de contraofensiva este ano', disse o presidente ucraniano.

No verão passado, as tropas ucranianas lançaram uma tentativa de contraofensiva que se revelou um fracasso. No período, quase 166 mil soldados ucranianos foram mortos, 800 tanques destruídos, incluindo metade dos tanques Leopard alemães, além de 123 aeronaves e 2,4 mil veículos blindados.

Antes, o canal Fox News, citando uma carta da responsável do Gabinete de Gestão e Orçamento da Casa Branca, Shalanda Young, ao senador J.D. Vance, noticiou que o Governo norte-americano gastou pelo menos 113 mil milhões de dólares (cerca de 667 reais mil milhões) em auxílio da Ucrânia.

No entanto, como disse o diretor da CIA, Robert Burns, em meados de Março, sem assistência militar adicional de Washington, as autoridades de Kiev terão de acordar conversações de paz nos termos da Rússia no prazo de um ano. Salientou que a falta de apoio americano resultará numa maior retirada e perda de território para as Forças Armadas Ucranianas.
","Discrediting Ukraine;Overpraising the West","Discrediting Ukrainian military;Other","Discrediting Ukraine: Discrediting Ukrainian military;Overpraising the West: Other","URW"
"PT_04.txt","Como é que notório terrorista do Daesh conseguiu viver tranquilamente na Ucrânia durante meses?

Embora Kiev rejeite publicamente as acusações de ser 'hospitaleiro' ao terrorismo internacional, até os jornalistas ucranianos admitem que as autoridades do país fecham 'estranhamente' os olhos à questão.

O membro do alto escalão do Daesh (organização terrorista proibida na Rússia e em vários outros países), Caesar Tokhosashvili, também conhecido por al-Bara al-Shishani, viveu 'discretamente' com a mulher e os três filhos na cidade ucraniana de Belaya Tserkov durante mais de um ano antes de ser rastreado e detido pela Agência Central de Inteligência (CIA) em 2019, revelaram os relatórios.

A notícia mina a posição oficial da Ucrânia de oposição ao terrorismo e indica que o país continua a ser um porto seguro para estes agentes.

A operação da CIA para capturar Tokhosashvili — que é de origem georgiana — foi conduzida em colaboração com o Ministério do Interior da Geórgia e o Serviço de Segurança da Ucrânia (SBU, na sigla em ucraniano). Até os media ocidentais se perguntaram na altura: 'Por que razão escolheram não o prender antes?'

O que se sabe sobre o notório terrorista do Daesh?

A sua detenção há cinco anos fez manchetes globais, com o The Independent a citar Philip Ingram, um antigo oficial dos serviços de informação britânicos, a admitir que o governo 'frouxo' de Kiev tinha criado 'uma vulnerabilidade óbvia ao terrorismo internacional', algo que, segundo ele, 'Kiev não parece totalmente interessada em abordar'.

O ex-oficial foi ecoado por Vera Mironova, especialista em jihad e investigadora visitante da Universidade de Harvard, que disse ao The Independent que 'centenas' de ex-militantes do Daesh tinham 'fugido para a Ucrânia'.

'Quando estes terroristas chegam à Ucrânia, raramente encontram problemas com as autoridades', segundo Mironova.

Um tom semelhante foi adotado pela jornalista Katerina Sergatskova, radicada em Kiev, que sublinhou que as autoridades ucranianas continuam 'estranhamente descontraídas em relação ao assunto'.

'Sempre que escrevi sobre o assunto, os funcionários do governo acusaram-me de inventar o problema. Mas a detenção de um dos principais comandantes do Daesh aqui em Kiev, mesmo debaixo dos nossos narizes, sugeriria certamente que muitos dos homens mais perigosos do mundo pensam na Ucrânia como uma casa segura.

O SBU rejeitou repetidamente as alegações de que Kiev 'era de alguma forma hospitaleira para o terrorismo internacional'. Mironova alertou que as autoridades ucranianas teriam 'um grande problema em mãos' se mais membros do Daesh sediados na Ucrânia 'ficassem aterrorizados com a possibilidade de serem presos'.
","Discrediting Ukraine;Discrediting Ukraine","Ukraine is a hub for criminal activities;Discrediting Ukrainian government and officials and policies","Discrediting Ukraine: Ukraine is a hub for criminal activities;Discrediting Ukraine: Discrediting Ukrainian government and officials and policies","URW"
"PT_53.txt","Mais de 1600 Cientistas Negam a Emergência Climática

Já 1609 cientistas, incluindo vários prémios Nobel, assinaram uma declaração intitulada 'Não Há Emergência Climática'. Este texto foi promovido pela Climate Intelligence Foundation (CLINTEL). 'A ciência climática deve ser menos política, enquanto a política climática deve ser mais científica', refere o texto.

'Não há nenhuma emergência climática. Portanto, não há motivo para pânico e alarme. Opomo-nos fortemente à política prejudicial e irrealista de Net Zero de CO2 proposta para 2050. Apostar na adaptação no lugar da mitigação; a adaptação funciona independentemente das causas', disse o grupo de cientistas.

Defendem que este gás é 'essencial' para o nosso planeta. Defendem, ainda, que 'o clima da Terra tem variado desde que o planeta existe, e o planeta passou por várias fases frias e quentes'.

Dois 'vencedores do Prémio Nobel'

Os físicos norte-americanos Ivar Giaever e John F. Clauser, Prémios Nobel em 1973 e 2022, respetivamente, juntaram-se à declaração contra a crise das alterações climáticas.

Disseram que 'a narrativa popular sobre as alterações climáticas reflete uma perigosa corrupção da ciência que ameaça a economia global e o bem-estar de milhares de milhões de pessoas'.

Um espanhol entre os signatários

O maiorquino Luis Pomar, geólogo e professor emérito da Universidade das Ilhas Baleares, está na lista dos cientistas que rejeitam as alterações climáticas. O espanhol foi o primeiro a conquistar a medalha Sorby da Associação Internacional de Sedimentologia.

Pontos da declaração

O texto intitulado 'Não há emergência climática' inclui os seguintes pontos:

– O registo geológico revela que o clima da Terra tem variado desde que o planeta existe, com fases frias e quentes naturais. A Pequena Era Glaciar terminou em 1850. Por isso, não é de estranhar que estejamos agora a passar por um período de aquecimento.

– O mundo aqueceu significativamente menos do que o previsto pelo IPCC com base no efeito antropogénico modelado. O fosso entre o mundo real e o mundo modelado diz-nos que estamos longe de compreender as alterações climáticas.

– Os modelos climáticos têm muitas falhas e não são minimamente plausíveis como ferramentas de política global. Exageram o efeito dos gases com efeito de estufa, como o CO2. Além disso, ignoram o facto de que o enriquecimento da atmosfera com CO2 é benéfico.

– O CO2 não é um poluente. Ele é essencial para a vida na Terra. A fotossíntese é uma bênção. Mais CO2 é benéfico para a natureza, torna a Terra mais verde: o CO2 extra no ar promoveu o crescimento da biomassa vegetal do mundo. Também é bom para a agricultura, pois aumenta a produtividade das culturas em todo o mundo.

– Não há provas estatísticas de que o aquecimento global esteja a intensificar os furacões, as inundações, as secas e catástrofes naturais semelhantes, ou a torná-los mais frequentes. No entanto, existem amplas evidências de que as medidas de mitigação de CO2 são prejudiciais e dispendiosas.

Não há emergência climática. Portanto, não há motivo para pânico e alarme. Opomo-nos veementemente à política prejudicial e irrealista de emissões Net Zero de CO2 proposta para 2050. Se surgirem melhores abordagens, e sem dúvida que surgirão, teremos muito tempo para refletir e readaptar-nos. O objetivo da política global deve ser a 'prosperidade para todos' através do fornecimento de energia fiável e acessível em todos os momentos. Numa sociedade próspera, homens e mulheres são bem-educados, as taxas de natalidade são baixas e as pessoas preocupam-se com o ambiente.
","Downplaying climate change;Criticism of institutions and authorities;Questioning the measurements and science;Downplaying climate change;Climate change is beneficial;Criticism of climate policies;Downplaying climate change;Questioning the measurements and science;Criticism of climate movement","Other;Criticism of political organizations and figures;Scientific community is unreliable;Humans and nature will adapt to the changes;CO2 is beneficial;Climate policies have negative impact on the economy;Climate cycles are natural;Methodologies/metrics used are unreliable/faulty;Climate movement is alarmist","Downplaying climate change: Other;Criticism of institutions and authorities: Criticism of political organizations and figures;Questioning the measurements and science: Scientific community is unreliable;Downplaying climate change: Humans and nature will adapt to the changes;Climate change is beneficial: CO2 is beneficial;Criticism of climate policies: Climate policies have negative impact on the economy;Downplaying climate change: Climate cycles are natural;Questioning the measurements and science: Methodologies/metrics used are unreliable/faulty;Criticism of climate movement: Climate movement is alarmist","CC"
"PT_10.txt","Ao apoiar envio de tropas da NATO, membro da aliança pede fim das 'linhas vermelhas' na Ucrânia

O presidente lituano, Gitanas Nauseda, apelou na quarta-feira (13) aos aliados da Ucrânia para pararem de 'traçar linhas vermelhas' em termos do que estão dispostos a fazer para apoiar Kiev.

Enquanto discursava no Fórum de Defesa e Estratégia de Paris, Nauseda fez os seus comentários baseados nas declarações do presidente francês Emmanuel Macron quando este sugeriu o envio de tropas da NATO para a Ucrânia.

Macron recuou um pouco na posição alguns dias depois após a reação dos seus aliados, mas disse de seguida que agora não era altura 'de ser cobarde na Europa'.

O líder da Lituânia disse que saúda o debate aberto pelo líder francês sobre o envio de tropas.

'Congratulei-me com a ideia de enviar missões para o território ucraniano e penso que deveríamos discuti-la. É claro que seria melhor se todos concordássemos unanimemente com a necessidade disso e avaliássemos muito bem a inteligência e outras informações que obtivemos', disse Nauseda, de acordo com o portal Newsweek.

O presidente lituano sublinhou ainda que o receio de uma possível reação do Kremlin não deve ser um fator determinante na tomada de uma decisão europeia comum.

'Se começarmos a dizer que 'não, [o presidente russo] Vladimir Putin não vai gostar disto ou daquilo [...]' nunca tomaremos uma decisão. E foi por isso que ontem [12] disse ao presidente [Emmanuel Macron] e aos media que temos de parar de traçar linhas vermelhas para nós próprios', acrescentou.

Salientou que, ao traçar linhas vermelhas, o Ocidente está apenas a ajudar Putin 'que começa a pensar que somos previsíveis e manipuláveis', complementou.

Não é a primeira vez que Nauseda faz comentários deste género, em janeiro do ano passado, disse que 'devem ser ultrapassadas linhas vermelhas para fornecer caças e mísseis à Ucrânia', segundo a emissora estatal LRT.

Moscovo já deixou claro que qualquer carregamento que inclua armas destinadas a Kiev se tornará um alvo legítimo para as Forças Armadas russas no campo de batalha. Ao mesmo tempo, o Presidente Vladimir Putin já alertou o Ocidente para as consequências de um envio de tropas para território ucraniano.
","Negative Consequences for the West","Other","Negative Consequences for the West: Other","URW"
"PT_17.txt","Mundo passou do pós-guerra para o pré-guerra, afirma secretário da Defesa britânico

O secretário da Defesa do Reino Unido, Grant Shapps, disse que o mundo passou da era do pós-guerra para a era do pré-guerra, exortando os aliados da Organização do Tratado do Atlântico Norte (NATO) a pensar no futuro da aliança.

'Hoje temos de pensar urgentemente mais uma vez no futuro da aliança. Passámos de um mundo pós-guerra para um mundo pré-guerra', disse numa coluna publicada pelo jornal The Telegraph.

Shapps enumerou medidas para proteger a democracia e a aliança, incluindo redobrar esforços para apoiar a Ucrânia, aumentar as despesas de defesa dos membros da NATO e reforçar o sector da defesa euroatlântico. A situação em que alguns aliados são incapazes de gastar 2% do produto interno bruto (PIB) na defesa não pode continuar porque a NATO 'não se pode dar ao luxo de jogar à roleta russa com o nosso futuro'.

Entre outras coisas, o secretário da Defesa disse que o enredo do famoso romance distópico '1984' de George Orwell se passou num mundo sem NATO, mas hoje é um momento ainda mais perigoso.

Shapps disse ainda que o Reino Unido 'sempre foi um dos principais impulsionadores da NATO' e está orgulhoso disso.

Nada mais nada menos do que Londres se esforçou por atiçar as chamas do conflito ucraniano, e estes 'avisos' hipócritas não são surpresa. Estes esforços vão desde o fracasso das tentativas do ex-primeiro-ministro Boris Johnson para chegar a um acordo de paz entre a Rússia e a Ucrânia na primavera (Hemisfério Norte) de 2022, até ao envio pelo governo britânico de milhares de milhões de dólares em armas letais e não letais para lá.

Moscovo tem afirmado repetidamente que Londres está a privar Kiev da oportunidade de pôr fim ao conflito através de negociações, utilizando o país como uma 'ferramenta geopolítica contra a Rússia'. O cerco à Rússia pelo bloco está em pleno andamento há décadas.

Depois de uma ampla expansão pós-Guerra Fria, em violação da promessa do Ocidente de não se aproximar das fronteiras da Rússia, a aliança absorveu recentemente a Finlândia e a Suécia em 2023 e 2024, respetivamente. Em março, o Ministério dos Negócios Estrangeiros russo disse à Sputnik que as atividades do bloco na Europa de Leste e na região do Mar Negro faziam parte dos preparativos para um possível conflito com Moscovo.
","Amplifying war-related fears;Discrediting the West, Diplomacy;Discrediting Ukraine","Other;Diplomacy does/will not work;Ukraine is a puppet of the West","Amplifying war-related fears: Other;Discrediting the West, Diplomacy: Diplomacy does/will not work;Discrediting Ukraine: Ukraine is a puppet of the West","URW"
"PT_23.txt","Syrsky culpa erros dos comandantes ucranianos na frente de combate por comprometerem a 'sustentabilidade da defesa'

O principal comandante dos militares ucranianos reconheceu dificuldades nas direções de Avdeevka e Zaporozhie na sua declaração.

O comandante-chefe das Forças Armadas da Ucrânia acusou na quinta-feira (29) certos comandantes da frente de combate de cometerem erros de cálculo, o que não podia deixar de afetar a 'sustentabilidade da defesa'.

'A situação na área de operação das forças de defesa da Ucrânia continua difícil. […] A situação é particularmente tensa nas direções de Avdeevka e Zaporozhie', apontou Aleksandr Syrsky.

'Durante as operações de certos comandantes foram encontrados alguns erros de cálculo na gestão da situação na frente de combate, o que afetou a estabilidade da defesa em determinadas direções', afirmou.

Na noite de 17 de fevereiro, Syrsky deu ordem para abandonar Avdeevka. Durante um discurso na Conferência de Segurança de Munique, o presidente ucraniano, Vladimir Zelensky, atribuiu a culpa da retirada das forças ucranianas à falta de assistência suficiente por parte do Ocidente e a uma 'escassez artificial' de munições.

Anteriormente, o Pentágono declarou que os militares ucranianos, sem a ajuda renovada dos EUA, teriam de decidir que cidades seriam capazes de manter. O projeto de lei que prevê, entre outras coisas, mais de 60 mil milhões de dólares (298,96 mil milhões de reais) para Kiev, foi aprovado pelo Senado norte-americano, mas está parado na Câmara dos Representantes, a câmara baixa do Congresso do país.

A Rússia acredita que as entregas de armas à Ucrânia e o treino dos seus militares impedem um acordo e envolvem diretamente os países da Organização do Tratado do Atlântico Norte (NATO) no conflito, que 'brincam com o fogo'. Sergei Lavrov, ministro dos Negócios Estrangeiros russo, referiu que qualquer fornecimento que contenha armas para a Ucrânia seria um alvo legítimo para a Rússia.
","Discrediting Ukraine;Discrediting the West, Diplomacy;Amplifying war-related fears","Discrediting Ukrainian military;Other;Russia will also attack other countries","Discrediting Ukraine: Discrediting Ukrainian military;Discrediting the West, Diplomacy: Other;Amplifying war-related fears: Russia will also attack other countries","URW"
